{
	"$schema": "../../schema.json",
	"titulo": "Mirador Cerro Baron",
	"portada": "portada",
	"id": "mirador-cerro-baron",
	"vendido": false,
	"start": {
		"day": 30,
		"month": 3,
		"year": 2025
	},
	"end": {
		"day": 20,
		"month": 5,
		"year": 2025
	},
	"measures": {
		"width": 46,
		"height": 60
	}
}
